,Labeled Data,DataRow ID,Compassion,Aggression,Count
384,"Our very priests must become mockers, if they shall encounter such ridiculous subjects as you are. When you speak best unto the purpose, it is not worth the wagging of your beards; and your beards deserve not so honourable a grave as to stuff a botcher's cushion, or to be entombed in an ass's pack- saddle. Yet you must be saying, Marcius is proud; who in a cheap estimation, is worth predecessors since Deucalion, though peradventure some of the best of 'em were hereditary hangmen. God-den to your worships: more of your conversation would infect my brain, being the herdsmen of the beastly plebeians: I will be bold to take my leave of you. How now, my as fair as noble ladies,--and the moon, were she earthly, no nobler,--whither do you follow your eyes so fast?",ckqi3jooie8xb0yu3ciln22lo,0.0,3.0,3
385,"Pardon me, Margaret; pardon me, sweet son: The Earl of Warwick and the duke enforced me.",ckqi3jopgeai90yu36dykdewm,2.0,0.0,4
386,"Parolles, was it not?",ckqi3joo9e8c20yu39rol77mq,0.0,0.0,2
387,"Peace to his soul, if God's good pleasure be! Lord cardinal, if thou think'st on heaven's bliss, Hold up thy hand, make signal of thy hope. He dies, and makes no sign. O God, forgive him!",ckqi3joo9e8a90yu3fs7q2iz4,4.0,0.0,4
388,Perchance she weeps because they kill'd her husband; Perchance because she knows them innocent.,ckqi3jopvebd30yu3c3greyfq,0.0,0.0,3
389,"Petruchio, shall I then come roundly to thee And wish thee to a shrewd ill-favour'd wife? Thou'ldst thank me but a little for my counsel: And yet I'll promise thee she shall be rich And very rich: but thou'rt too much my friend, And I'll not wish thee to her.",ckqi3jooke92l0yu3bfnpe362,1.0,0.0,3
390,Pink for flower.,ckqi3jooke93k0yu3g9yn0ogn,0.0,0.0,1
391,"Pray do not mock me. I am a very foolish, fond old man, Fourscore and upward,  not an hour more nor less, And, to deal plainly, I fear I am not in my perfect mind. Methinks I should know you, and know this man, Yet I am doubtful, for I am mainly ignorant What place this is; and all the skill I have Remembers not these garments, nor I know not Where I did lodge last night. Do not laugh at me, For, as I am a man, I think this lady To be my child, Cordelia.",ckqi3joole9760yu32z0may9a,0.0,1.0,2
392,"Pray you then, Conduct me to the queen.",ckqi3jooce8ib0yu366rqb7je,0.0,0.0,4
393,"Pray you, sir, was't not the wise woman of  Brainford?",ckqi3jopcea3t0yu30sgacijj,0.0,0.0,3
394,"Prithee, listen well: I heard a bustling rumor, like a fray, And the wind brings it from the Capitol.",ckqi3jopoeany0yu3bfx68k5s,0.0,0.0,3
395,"Richmond! When last I was at Exeter, The mayor in courtesy show'd me the castle, And call'd it Rougemont: at which name I started, Because a bard of Ireland told me once I should not live long after I saw Richmond.",ckqi3jopueb9c0yu32zgrgtp1,0.0,1.0,4
396,"Rightly reasoned, and in his own division: and, by my troth, there's one meaning well suited.",ckqi3joole9800yu316bjg7uk,0.0,0.0,1
397,"Rosaline, by good hap.",ckqi3jopae9y90yu38jwj0o9m,0.0,0.0,2
398,"Rugby, come to the court with me. – By gar, if  I have not Anne Page, I shall turn your head out of my  door. – Follow my heels, Rugby.",ckqi3joope9jo0yu30v5z9bhe,0.0,1.0,2
399,"Save him, save him.",ckqi3joofe8m20yu38dov433t,1.0,0.0,3
400,Say I she is not fair?,ckqi3jopae9y40yu3027paiej,0.0,0.0,3
401,"Say, I will love her everlastingly.",ckqi3jopyeboh0yu34dxd828r,2.0,0.0,2
402,"See better Lear, and let me still remain The true blank of thine eye.",ckqi3jooqe9oy0yu3exot33xs,0.0,0.0,2
403,"See where it comes! Behavior, what wert thou Till this madman show'd thee? and what art thou now?",ckqi3joo6e84z0yu34mbyb1p4,0.0,2.0,4
404,"Send for him, good uncle.",ckqi3jopwebf10yu3f1176c3i,0.0,0.0,3
405,"Seven year and a half, sir.",ckqi3joooe9fi0yu30ulq7pyv,0.0,0.0,3
406,Shall I speak a word in your ear?,ckqi3jopreay30yu3drbfhgfj,0.0,0.0,3
407,"She is not well; but yet she has her health: she's very merry; but yet she is not well: but thanks be given, she's very well and wants nothing i', the world; but yet she is not well.",ckqi3jooke9300yu33zsgaeq3,2.0,0.0,3
408,She is young and apt: Our own precedent passions do instruct us What levity's in youth.,ckqi3joope9if0yu3cn1bfkh1,1.0,0.0,3
409,"She will, she will; justice hath liquored her. We steal as in a castle, cocksure; we have the receipt of fern-seed, we walk invisible.",ckqi3joooe9h60yu3eybg18oq,0.0,1.0,3
410,"Shepherdess, A fair one are you--well you fit our ages With flowers of winter.",ckqi3jopzebqu0yu39e9achvt,2.0,0.0,3
411,"Silence is the perfectest herald of joy: I were but little happy, if I could say how much. Lady, as you are mine, I am yours: I give away myself for you and dote upon the exchange.",ckqi3joome9b20yu3fbadeapk,3.0,0.0,3
412,"Sir Thomas Lovell, had the cardinal But half my lay thoughts in him, some of these Should find a running banquet ere they rested, I think would better please 'em: by my life, They are a sweet society of fair ones.",ckqi3jooke92q0yu34syb6t7s,2.0,0.0,2
413,"Sir, I will use My utmost skill in his recovery, Provided That none but I and my companion maid Be suffer'd to come near him.",ckqi3joooe9fn0yu3ho2qcfua,1.0,0.0,2
414,"Sir, but I do; or else I would be hence.",ckqi3jopseazr0yu3cqfw99zr,0.0,0.0,3
415,"Sir, he's a good dog and a fair dog. Can there  be more said? He is good and fair. -- Is Sir John Falstaff  here?",ckqi3jopseb240yu35uqi12wo,1.0,0.0,3
416,"Sir, look well to my husband's house; and--",ckqi3jooie8ya0yu390jagil1,0.0,0.0,2
417,"Sir, pardon me in what I have to say: Your plainness and your shortness please me well. Right true it is, your son Lucentio here Doth love my daughter and she loveth him, Or both dissemble deeply their affections: And therefore, if you say no more than this, That like a father you will deal with him And pass my daughter a sufficient dower, The match is made, and all is done: Your son shall have my daughter with consent.",ckqi3joppeaqv0yu3bhynhyvf,3.0,0.0,3
418,"Sir, sir, the first's for me; let her go by.",ckqi3jop7e9rb0yu3g64p05wj,0.0,0.0,3
419,"Sir, there is a proclamation that you are vanished.",ckqi3jopseb1u0yu3fh6rf383,0.0,0.0,2
420,"Sir, your queen must overboard: the sea works high, the wind is loud, and will not lie till the ship be cleared of the dead.",ckqi3jopueb8n0yu3e3vf13rk,0.0,0.0,3
421,"Sirrah, bring Barnardine hither.",ckqi3joooe9g20yu303js5m6e,0.0,0.0,2
422,So could I too.,ckqi3jooke9350yu3eorgeszf,0.0,0.0,2
423,"So did we all. But, come, let's home.",ckqi3jooie8wm0yu3grqag2tn,0.0,0.0,3
424,"So it should seem by that I have to say. First, he commends him to your noble lordship.",ckqi3jopoeamp0yu30sc86g43,1.0,0.0,4
425,Some love of yours hath writ to you in rhyme.,ckqi3joone9du0yu3giuo5rc6,0.0,0.0,4
426,"Some such thing I said, and said no more but what my thoughts Did warrant me was likely.",ckqi3jop9e9ux0yu30xhd6a6k,0.0,0.0,3
427,"Something browner than Judas's marry, his kisses are Judas's own children.",ckqi3jopxebj70yu3f9vpctdb,0.0,1.0,2
428,"Speak softly; yonder, as I think, he walks.",ckqi3jooke93f0yu398gf58vd,0.0,0.0,3
429,Speak within door.,ckqi3jopcea2p0yu3evo0c2kb,0.0,0.0,2
430,"Sprawl'st thou? take that, to end thy agony.",ckqi3joone9dz0yu353bv70py,1.0,0.0,3
431,"Stand fast together, lest some friend of Caesar's Should chance--",ckqi3joofe8nl0yu3d8ccbg7t,0.0,0.0,4
432,Stand where the torch may not discover us.,ckqi3joome99t0yu396wd7iz2,0.0,0.0,4
433,"Stay, officer: he shall not go to prison.",ckqi3joole95i0yu33zix2l6y,0.0,0.0,3
434,Stuck with cloves.,ckqi3joole96m0yu35sa02pz7,0.0,0.0,3
435,"Suffer love! a good epithet! I do suffer love indeed, for I love thee against my will.",ckqi3jooqe9q20yu306hm9ug7,2.0,2.0,3
436,"Sweet hearts, we shall be rich ere we depart, If fairings come thus plentifully in: A lady wall'd about with diamonds! Look you what I have from the loving king.",ckqi3jopyebni0yu3aedd4s8r,3.0,0.0,3
437,"Sweet honey Greek, tempt me no more to folly.",ckqi3jopcea2z0yu33tys1ho1,0.0,0.0,3
438,"Sweet, except not any; Except thou wilt except against my love.",ckqi3joobe8gi0yu3bhpqad89,0.0,0.0,2
439,"Take that, thou likeness of this railer here.",ckqi3joooe9gw0yu33ukqccs1,0.0,0.0,1
440,"Talking of hawking; nothing else, my lord. Now, by God's mother, priest, I'll shave your crown for this, Or all my fence shall fail.",ckqi3jopneajx0yu38ilfcrag,0.0,2.0,3
441,Taurus!,ckqi3jooge8qx0yu35duw1j14,0.0,0.0,3
442,Tell me thine first.,ckqi3jooqe9np0yu36k1o5mqc,0.0,0.0,3
443,"Thaliard, You are of our chamber, and our mind partakes Her private actions to your secrecy; And for your faithfulness we will advance you. Thaliard, behold, here's poison, and here's gold; We hate the prince of Tyre, and thou must kill him: It fits thee not to ask the reason why, Because we bid it. Say, is it done?",ckqi3jopuebab0yu37ysy2ak6,0.0,2.0,2
444,"That fellow is a fellow of much licence: let him be called before us. Away with her to prison! Go to; no more words. Provost, my brother Angelo will not be altered; Claudio must die to-morrow: let him be furnished with divines, and have all charitable preparation. if my brother wrought by my pity, it should not be so with him.",ckqi3jopneakr0yu3hyac4jtd,0.0,2.0,3
445,"That you might still have worn the petticoat, And ne'er have stol'n the breech from Lancaster.",ckqi3jopseb1a0yu37kkj0ppr,0.0,0.0,3
446,"That you must.  Will you, upon good dowry, marry her?",ckqi3jopseb0v0yu3gkw427en,0.0,0.0,3
447,"That's I, an't like your grace: I came to her from Claudio, and desired her To try her gracious fortune with Lord Angelo For her poor brother's pardon.",ckqi3jopwebht0yu36ez6ag95,2.0,0.0,4
448,That's my sister. ANTIPHOLUS,ckqi3jop9e9w10yu3ebjx819j,0.0,0.0,4
449,"The Lord in heaven bless thee, noble Harry!",ckqi3jop8e9u80yu35jgoadnv,1.0,0.0,1
450,"The Thane of Fife had a wife, where is she now?  What, will these hands ne'er be clean? No more o'that,  my lord, no more o'that. You mar all with this star ting.",ckqi3jopzebs30yu3ea203rap,0.0,0.0,2
451,"The enemy's in view. Draw up your powers. Here is the guess of their true strength and forces By diligent discovery, but your haste Is now urged on you.",ckqi3joobe8gs0yu3d9qu7x2n,0.0,0.0,3
452,The heavens give safety to your purposes!,ckqi3jopvebco0yu3c89e1ti8,2.0,0.0,3
453,The image of it gives me content already; and I trust it will grow to a most prosperous perfection.,ckqi3joo5e8360yu3asfdg8a8,1.0,0.0,2
454,"The king of heaven forbid our lord the king Should so with civil and uncivil arms Be rush'd upon! Thy thrice noble cousin Harry Bolingbroke doth humbly kiss thy hand; And by the honourable tomb he swears, That stands upon your royal grandsire's bones, And by the royalties of both your bloods, Currents that spring from one most gracious head, And by the buried hand of warlike Gaunt, And by the worth and honour of himself, Comprising all that may be sworn or said, His coming hither hath no further scope Than for his lineal royalties and to beg Enfranchisement immediate on his kn ees: Which on thy royal party granted once, His glittering arms he will commend to rust, His barbed steeds to stables, and his heart To faithful service of your majesty. This swears he, as he is a prince, is just; And, as I am a gentleman, I credit him.",ckqi3jopteb5q0yu37e6f0nbg,2.0,0.0,3
455,The matter?,ckqi3jopeea9x0yu35sgs3ty7,0.0,0.0,3
456,The noblest mind he carries That ever govern'd man.,ckqi3joo7e86s0yu30mzeao7v,3.0,0.0,3
457,"The people fear me; for they do observe Unfather'd heirs and loathly births of nature: The seasons change their manners, as the year Had found some months asleep and leap'd them over.",ckqi3jopreazc0yu38hsea1x3,0.0,1.0,3
458,"The princely Charles of France, thy countryman.",ckqi3joone9cg0yu3aplm99ht,0.0,0.0,1
459,"The reformation of our travell'd gallants, That fill the court with quarrels, talk, and tailors.",ckqi3joooe9gc0yu309tl23h1,0.0,0.0,3
460,The salt in them is hot. Within me is a hell; and there the poison Is as a fiend confined to tyrannize On unreprievable condemned blood.,ckqi3joome9as0yu3h4uugy03,0.0,1.0,2
461,"The same, sir.",ckqi3jooie8y50yu38w7o8e2w,0.0,0.0,3
462,"The service, and the loyalty I owe In doing it, pays itself.  Your highness' part Is to receive our duties,  and our duties Are to your throne and state,  children and servants, Which do but what they should  by doing everything  Safe toward your love  and honor. ",ckqi3jooie8wh0yu3cmntbaph,4.0,0.0,4
463,"The worst of all her scholars, my good lord.",ckqi3jooje8yp0yu3ew7sgjvk,0.0,1.0,2
464,Their coronets say so. These are stars indeed; And sometimes falling ones.,ckqi3joooe9et0yu312zmduwu,0.0,0.0,3
465,"Their eyes, villain, their eyes!",ckqi3jooke91c0yu3a9xj1940,0.0,2.0,4
466,"Then 'twas my turn to fly, and now 'tis thine.",ckqi3jopwebgz0yu37gedabo8,1.0,0.0,4
467,"Then further, all dissembling set aside, Tell me for truth the measure of his love Unto our sister Bona.",ckqi3joppear50yu33eupaz8a,0.0,0.0,4
468,Then give me leave to go.,ckqi3jopgeahk0yu32vi9hakc,0.0,0.0,3
469,"Then is there mirth in heaven, When earthly things made even Atone together. Good duke, receive thy daughter Hymen from heaven brought her, Yea, brought her hither, That thou mightst join her hand with his Whose heart within his bosom is.",ckqi3jooae8ch0yu387g7demi,1.0,0.0,2
470,Then say at once if I maintain'd the truth; Or else was wrangling Somerset in the error?,ckqi3jopzebpv0yu3g32qh2v9,0.0,0.0,4
471,"Then thus: Edward the Third, my lords, had seven sons: The first, Edward the Black Prince, Prince of Wales; The second, William of Hatfield, and the third, Lionel Duke of Clarence: next to whom Was John of Gaunt, the Duke of Lancaster; The fifth was Edmund Langley, Duke of York; The sixth was Thomas of Woodstock, Duke of Gloucester; William of Windsor was the seventh and last. Edward the Black Prince died before his father And left behind him Richard, his only son, Who after Edward the Third's death reign'd as king; Till Henry Bolingbroke, Duke of Lancaster, The eldest son and heir of John of Gaunt, Crown'd by the name of Henry the Fourth, Seized on the realm, deposed the rightful king, Sent his poor queen to France, from whence she came, And him to Pomfret; where, as all you know, Harmless Richard was murder'd traitorously.",ckqi3joo9e8ao0yu36xsg5098,2.0,0.0,4
472,"Then yield thee coward, And live to be the show and gaze o'th' time. We'll have thee as our rarer monsters are Painted upon a pole and underwrit, ""Here may you see the tyrant.""",ckqi3jopoeama0yu31ktq476v,0.0,4.0,4
473,"There is among the Greeks Achilles, a better man than Troilus.",ckqi3joome99y0yu3752ubk84,1.0,0.0,3
474,"There is something in the wind, that we cannot get in.",ckqi3jopfeag10yu3g4hq2yo9,0.0,0.0,2
475,"There's none but witches do inhabit here; And therefore 'tis high time that I were hence. She that doth call me husband, even my soul Doth for a wife abhor. But her fair sister, Possess'd with such a gentle sovereign grace, Of such enchanting presence and discourse, Hath almost made me traitor to myself: But, lest myself be guilty to self-wrong, I'll stop mine ears against the mermaid's song.",ckqi3joofe8ls0yu30a3c25ma,2.0,1.0,2
476,"There, my lord: The high promotion of his grace of Canterbury; Who holds his state at door, 'mongst pursuivants, Pages, and footboys.",ckqi3jooke91h0yu33td1439s,1.0,0.0,3
477,"Therefore he will be, Timon: His honesty rewards him in itself; It must not bear my daughter.",ckqi3jopqeatn0yu3dor80szy,1.0,0.0,3
478,"Therefore, as you unwind her love from him, Lest it should ravel and be good to none, You must provide to bottom it on me; Which must be done by praising me as much As you in worth dispraise Sir Valentine.",ckqi3jopeea9d0yu317fmbyly,0.0,0.0,4
479,They are all welcome. What watchful cares do interpose themselves Betwixt your eyes and night?,ckqi3joope9j40yu3f83n3pe2,2.0,0.0,4
480,Think you so? Which way do you judge my wit would fly?,ckqi3jopueb920yu30vf57mnd,0.0,0.0,3
481,This Caesar was a tyrant.,ckqi3joope9m10yu349m18oli,0.0,2.0,3
482,"This Sir John, cousin, that comes hither anon about soldiers?",ckqi3joo6e85j0yu37mwl5amt,0.0,0.0,3
483,This Trojan scorns us; or the men of Troy Are ceremonious courtiers.,ckqi3joo9e8bx0yu38nuz0ss4,0.0,0.0,3
484,"This gentleman, the prince's near ally, My very friend, hath got his mortal hurt In my behalf; my reputation stain'd With Tybalt's slander,--Tybalt, that an hour Hath been my kinsman! O sweet Juliet, Thy beauty hath made me effeminate And in my temper soften'd valour's steel!",ckqi3jopzebsx0yu3a9mj188l,2.0,0.0,2
485,"This is a slave, whose easy-borrowed pride Dwells in the sickly grace of her he follows. Out, varlet, from my sight.",ckqi3jopseb290yu3hlgb3ykj,0.0,2.0,2
486,"This is practice, Gloucester. By th'law of war thou wast not bound to answer An unknown opposite. Thou art not vanquished, But cozened and beguiled.",ckqi3jopteb420yu3h8155tt5,0.0,3.0,4
487,"This is the prettiest low-born lass that ever Ran on the green-sward: nothing she does or seems But smacks of something greater than herself, Too noble for this place.",ckqi3jopneak20yu3cytu4x5j,2.0,0.0,2
488,This is the strangest tale that ever I heard.,ckqi3joooe9gh0yu3c3zi55ud,0.0,0.0,2
489,"This purse of ducats I received from you, And Dromio, my man, did bring them me. I see we still did meet each other's man, And I was ta'en for him, and he for me, And thereupon these errors are arose. ANTIPHOLUS",ckqi3joo8e87w0yu32mrkbeve,0.0,0.0,3
490,Thou art an old love-monger and speakest skilfully.,ckqi3jop8e9s50yu3hkn348wy,2.0,0.0,3
491,"Thou canst not speak of that thou dost not feel: Wert thou as young as I, Juliet thy love, An hour but married, Tybalt murdered, Doting like me and like me banished, Then mightst thou speak, then mightst thou tear thy hair, And fall upon the ground, as I do now, Taking the measure of an unmade grave.",ckqi3jooee8ke0yu3034nf0af,0.0,0.0,3
492,Thou dost not speak so much.,ckqi3joooe9ia0yu327cb9y2r,0.0,0.0,4
493,"Thou sayest true: 'tis not our bringing up of poor bastards,--as, I think, I have brought up some eleven--",ckqi3joone9d50yu365377im9,0.0,0.0,3
494,"Thou shalt get kings, though thou be none. So all hail Macbeth and Banquo.",ckqi3joole97g0yu34j3t8l7n,0.0,0.0,3
495,"Though Page be a secure fool and stands so  firmly on his wife's frailty, yet I cannot put off my o pinion so easily. She was in his company at Page's house,  and what they made there, I know not. Well, I will look  further into't, and I have a disguise to sound Falstaff. If  I find her honest, I lose not my labor. If she be other wise, 'tis labor well bestowed. Exit.",ckqi3jopoeaod0yu38qtl0bkp,0.0,0.0,3
496,"Thus do they, sir: they take the flow o' the Nile By certain scales i' the pyramid; they know, By the height, the lowness, or the mean, if dearth Or foison follow: the higher Nilus swells, The more it promises: as it ebbs, the seedsman Upon the slime and ooze scatters his grain, And shortly comes to harvest.",ckqi3jopfeaf70yu3c5im18r4,0.0,0.0,2
497,"Thus far, with rough and all-unable pen, Our bending author hath pursued the story, In little room confining mighty men, Mangling by starts the full course of their glory. Small time, but in that small most greatly lived This star of England: Fortune made his sword; By which the world's best garden be achieved, And of it left his son imperial lord. Henry the Sixth, in infant bands crown'd King Of France and England, did this king succeed; Whose state so many had the managing, That they lost France and made his England bleed: Which oft our stage hath shown; and, for their sake, In your fair minds let this acceptance take.",ckqi3jopgeahf0yu33f1f64lm,2.0,0.0,4
498,"Thy mistress' marks? what mistress, slave, hast thou?",ckqi3joohe8uj0yu30ptp7rlp,0.0,2.0,3
499,Thy wit is a very bitter sweeting; it is a most sharp sauce.,ckqi3joo9e8at0yu3bs3phtcr,0.0,0.0,3
500,Till then I'll keep him dark and safely lock'd.,ckqi3joo7e86d0yu3axpg3bqx,0.0,1.0,3
501,"Titinius is enclosèd round about With horsemen that make to him on the spur, Yet he spurs on. Now they are almost on him! Now, Titinius! Now some light. Oh, he lights too. He's ta'en! And hark! They shout for joy.",ckqi3joobe8hc0yu3d19v7a6j,0.0,0.0,2
502,To Lacedaemon did my land extend.,ckqi3jopoeal60yu35w0b7a95,0.0,0.0,3
503,"To fetch her fan, her gloves, her mask, nor nothing?",ckqi3jooke94j0yu37cg5bwps,0.0,0.0,4
504,To move wild laughter in the throat of death? It cannot be; it is impossible: Mirth cannot move a soul in agony.,ckqi3joo8e8810yu31kgj5khl,0.0,1.0,2
505,"To this effect, Achilles, have I moved you: A woman impudent and mannish grown Is not more loathed than an effeminate man In time of action. I stand condemn'd for this; They think my little stomach to the war And your great love to me restrains you thus: Sweet, rouse yourself; and the weak wanton Cupid Shall from your neck unloose his amorous fold, And, like a dew-drop from the lion's mane, Be shook to air.",ckqi3jop7e9rl0yu36u7jehvh,0.0,2.0,4
506,Too bitter is thy jest. Are we betray'd thus to thy over-view?,ckqi3joole94y0yu3gm3qgqsv,0.0,3.0,4
507,"Truly, shepherd, in respect of itself, it is a good life, but in respect that it is a shepherd's life, it is naught. In respect that it is solitary, I like it very well; but in respect that it is private, it is a very vile life. Now, in respect it is in the fields, it pleaseth me well; but in respect it is not in the court, it is tedious. As is it a spare life, look you, it fits my humour well; but as there is no more plenty in it, it goes much against my stomach. Hast any philosophy in thee, shepherd?",ckqi3joofe8o50yu30nd55zug,0.0,0.0,3
508,"Truly, sir, I think you'll hardly win her.",ckqi3jopoeao30yu3cqg1cisw,0.0,0.0,2
509,"Turn head, and stop pursuit; for coward dogs Most spend their mouths when what they seem to threaten Runs far before them. Good my sovereign, Take up the English short, and let them know Of what a monarchy you are the head: Self-love, my liege, is not so vile a sin As self-neglecting.",ckqi3joone9eo0yu33pks87p1,0.0,3.0,4
510,"Tush, man, abodements must not now affright us: By fair or foul means we must enter in, For hither will our friends repair to us.",ckqi3joppeapc0yu36324cngr,0.0,0.0,1
511,"Tyre, I now look from thee then, and to Tarsus Intend my travel, where I'll hear from thee; And by whose letters I'll dispose myself. The care I had and have of subjects' good On thee I lay whose wisdom's strength can bear it. I'll take thy word for faith, not ask thine oath: Who shuns not to break one will sure crack both: But in our orbs we'll live so round and safe, That time of both this truth shall ne'er convince, Thou show'dst a subject's shine, I a true prince.",ckqi3jopcea4x0yu3gzqygymp,1.0,0.0,4
512,"Unhappy fortune! by my brotherhood, The letter was not nice but full of charge Of dear import, and the neglecting it May do much danger. Friar John, go hence; Get me an iron crow, and bring it straight Unto my cell.",ckqi3jooae8e00yu3g1la1uct,0.0,0.0,3
513,"Unhappy that I am, I cannot heave My heart into my mouth. I love your majesty According to my bond, no more nor less.",ckqi3jop9e9wl0yu3ev96ei7c,2.0,0.0,3
514,"Unless I have mista'en his colours much, Which well I am assured I have not done, His regiment lies half a mile at least South from the mighty power of the king.",ckqi3jopxebkq0yu37i5mbpxc,0.0,0.0,3
515,"Upon his many protestations to marry me when his wife was dead, I blush to say it, he won me. Now is the Count Rousillon a widower: his vows are forfeited to me, and my honour's paid to him. He stole from Florence, taking no leave, and I follow him to his country for justice: grant it me, O king! in you it best lies; otherwise a seducer flourishes, and a poor maid is undone. DIANA CAPILET.",ckqi3jopreawu0yu3egvfh87n,0.0,2.0,3
516,"Verona, for a while I take my leave, To see my friends in Padua, but of all My best beloved and approved friend, Hortensio; and I trow this is his house. Here, sirrah Grumio; knock, I say.",ckqi3jopteb6k0yu366d35yrj,2.0,0.0,3
517,"Very vilely in the morning, when he is sober, and most vilely in the afternoon, when he is drunk: when he is best, he is a little worse than a man, and when he is worst, he is little better than a beast: and the worst fall that ever fell, I hope I shall make shift to go without him.",ckqi3joope9lm0yu343jleg92,0.0,1.0,3
518,"We arrest your word. Boyet, you can produce acquittances For such a sum from special officers Of Charles his father.",ckqi3jopqeauw0yu3d5ha67w7,0.0,0.0,3
519,We do remember; but our argument Is all too heavy to admit much talk.,ckqi3jopxebjw0yu35y3h3ldm,0.0,0.0,3
520,"We know thy charge, Brakenbury, and will obey.",ckqi3joore9qh0yu3dwz31wny,0.0,0.0,3
521,"We shall find a time, Audrey; patience, gentle Audrey.",ckqi3jopseb0l0yu3ajpzbsmp,1.0,0.0,3
522,"We were not born to sue, but to command; Which since we cannot do to make you friends, Be ready, as your lives shall answer it, At Coventry, upon Saint Lambert's day: There shall your swords and lances arbitrate The swelling difference of your settled hate: Since we can not atone you, we shall see Justice design the victor's chivalry. Lord marshal, command our officers at arms Be ready to direct these home alarms.",ckqi3joohe8s10yu3cr4o8kt4,0.0,3.0,4
523,We will not meddle with him till he come; for his presence must be the whip of the other.,ckqi3joo6e85e0yu39lhcafla,0.0,1.0,4
524,"We'll have this song out anon by ourselves: my father and the gentlemen are in sad talk, and we'll not trouble them. Come, bring away thy pack after me. Wenches, I'll buy for you both. Pedlar, let's have the first choice. Follow me, girls.",ckqi3jooje90x0yu35np8frs4,1.0,0.0,4
525,We'll mutiny!,ckqi3jooqe9nk0yu302g12xqb,0.0,3.0,4
526,"Welcome, Ancient Pistol. Here, Pistol, I charge you with a cup of sack: do you discharge upon mine hostess.",ckqi3jooqe9oe0yu3832o03b4,0.0,1.0,3
