,Labeled Data,DataRow ID,Compassion,Aggression,Count
261,"I'll follow you, good Master Robert Shallow. Bardolph, look to our horses. If I were sawed into quantities, I should make four dozen of such bearded hermits' staves as Master Shallow. It is a wonderful thing to see the semblable coherence of his men's spirits and his: they, by observing of him, do bear themselves like foolish justices; he, by conversing with them, is turned into a justice-like serving-man: their spirits are so married in conjunction with the participation of society that they flock together in consent, like so many wild-geese. If I had a suit to Master Shallow, I would humour his men with the imputation of being near their master: if to his men, I would curry with Master Shallow that no man could better command his servants. It is certain that either wise bearing or ignorant carriage is caught, as men take diseases, one of another: therefore let men take heed of their company. I will devise matter enough out of this Shallow to keep Prince Harry in continual laughter the wearing out of six fashions, which is four terms, or two actions, and a' shall laugh without intervallums. O, it is much that a lie with a slight oath and a jest with a sad brow will do with a fellow that never had the ache in his shoulders! O, you shall see him laugh till his face be like a wet cloak ill laid up!",ckqi3jooae8d60yu3bc6mecs0,2.0,0.0,3
262,"I'll meet you at the turn. What a god's gold, That he is worshipp'd in a baser temple Than where swine feed! 'Tis thou that rigg'st the bark and plough'st the foam, Settlest admired reverence in a slave: To thee be worship! and thy saints for aye Be crown'd with plagues that thee alone obey! Fit I meet them.",ckqi3jopbe9zn0yu336oy81h5,1.0,2.0,4
263,"I'll not put The dibble in earth to set one slip of them; No more than were I painted I would wish This youth should say 'twere well and only therefore Desire to breed by me. Here's flowers for you; Hot lavender, mints, savoury, marjoram; The marigold, that goes to bed wi' the sun And with him rises weeping: these are flowers Of middle summer, and I think they are given To men of middle age. You're very welcome.",ckqi3jopqeasy0yu3attv6g1f,1.0,0.0,2
264,I'th'mire.,ckqi3jopvebdx0yu3a5xohud4,0.0,0.0,3
265,"I, madam? no, I have no reason for it; That is my brother's plea and none of mine; The which if he can prove, a' pops me out At least from fair five hundred pound a year: Heaven guard my mother's honour and my land!",ckqi3jopeeabg0yu33x2p3up7,0.0,0.0,3
266,"If I put any tricks upon 'em, sir, they shall be jades' tricks; which are their own right by the law of nature.",ckqi3jopoeakw0yu3d2clfk5e,0.0,0.0,1
267,"If I thought that, I tell thee, homicide, These nails should rend that beauty from my cheeks.",ckqi3jopqeavl0yu331zw76st,0.0,3.0,4
268,"If the business be of any difficulty, and this morning your departure hence, it requires haste of your lordship.",ckqi3joo9e89z0yu33cva31ng,0.0,0.0,3
269,"If you misdoubt me that I am not she, I know not how I shall assure you further, But I shall lose the grounds I work upon.",ckqi3jopgeagq0yu31hg9128d,0.0,0.0,3
270,"Image of pride, why should I hold my peace?",ckqi3jopxebis0yu3asaahkdt,0.0,0.0,2
271,"In God's name what are you, and how came you hither?",ckqi3jooqe9pd0yu325ptf1m2,0.0,1.0,2
272,"In thy foul throat thou liest: Queen Margaret saw Thy murderous falchion smoking in his blood; The which thou once didst bend against her breast, But that thy brothers beat aside the point.",ckqi3jopueb9w0yu3ek90ds7m,0.0,3.0,3
273,"Indeed, I am no mourner for that news, Because they have been still mine enemies: But, that I'll give my voice on Richard's side, To bar my master's heirs in true descent, God knows I will not do it, to the death.",ckqi3jopae9yj0yu3aib68eup,0.0,2.0,3
274,"Indeed, he looks younger than he did, by the loss of a beard.",ckqi3jopreaxo0yu301wch8h2,0.0,0.0,3
275,Is Banquo gone from court?,ckqi3jopvebds0yu321naevv4,0.0,0.0,4
276,"Is Talbot slain, the Frenchmen's only scourge, Your kingdom's terror and black Nemesis? O, were mine eyeballs into bullets turn'd, That I in rage might shoot them at your faces! O, that I could but call these dead to life! It were enough to fright the realm of France: Were but his picture left amongst you here, It would amaze the proudest of you all. Give me their bodies, that I may bear them hence And give them burial as beseems their worth.",ckqi3jopgeaji0yu36kie9dj7,1.0,3.0,3
277,Is he ready To come abroad?,ckqi3jop8e9sk0yu3fe16b5zo,0.0,0.0,2
278,It is a fault that springeth from your eye. ANTIPHOLUS,ckqi3jopvebdd0yu3f57z2k04,0.0,1.0,4
279,"It is not seen enough, you should wear it in your cap. By my troth, I am sick.",ckqi3jopzebry0yu3ar0kd7af,0.0,0.0,3
280,"It is to be recovered: but that the merit of service is seldom attributed to the true and exact performer, I would have that drum or another, or 'hic jacet.'",ckqi3joone9ee0yu3b0r4h2xw,0.0,0.0,3
281,"It was his bidding; therefore, good Emilia, Give me my nightly wearing, and adieu. We must not now displease him.",ckqi3jopteb6a0yu3gu3f88sf,2.0,0.0,2
282,"It will have blood, they say-- blood will have blood. Stones have been known to move and trees to speak, Augurs and understood relations have By maggot-pies and choughs and rooks brought forth The secret'st man of blood. What is the night?",ckqi3joohe8s60yu3c3apbjco,0.0,2.0,3
283,"It's supper-time, my lord; It's nine o'clock.",ckqi3jopbea1v0yu3grst1qyn,0.0,0.0,2
284,"Kill thy physician, and thy fee bestow Upon the foul disease. Revoke thy gift, Or whilst I can vent clamor from my throat I'll tell thee thou dost evil.",ckqi3jopreaz70yu3dejxdz04,0.0,4.0,4
285,"King Henry, be thy title right or wrong, Lord Clifford vows to fight in thy defence: May that ground gape and swallow me alive, Where I shall kneel to him that slew my father!",ckqi3joo7e87h0yu33ngk629p,1.0,2.0,3
286,"King Richard Coeur-de-lion was thy father: By long and vehement suit I was seduced To make room for him in my husband's bed: Heaven lay not my transgression to my charge! Thou art the issue of my dear offence, Which was so strongly urged past my defence.",ckqi3joo5e82c0yu31liv5vd8,0.0,1.0,3
287,"Let me have audience for a word or two: I am the second son of old Sir Rowland, That bring these tidings to this fair assembly. Duke Frederick, hearing how that every day Men of great worth resorted to this forest, Address'd a mighty power; which were on foot, In his own conduct, purposely to take His brother here and put him to the sword: And to the skirts of this wild wood he came; Where meeting with an old religious man, After some question with him, was converted Both from his enterprise and from the world, His crown bequeathing to his banish'd brother, And all their lands restored to them again That were with him exiled. This to be true, I do engage my life.",ckqi3jopeeab60yu39vmvgel6,0.0,0.0,2
288,Let not your ears despise my tongue forever Which shall possess them with the heaviest sound That ever yet they heard.,ckqi3jopwebhy0yu34yir82zf,0.0,0.0,3
289,"Let us from point to point this story know, To make the even truth in pleasure flow. If thou be'st yet a fresh uncropped flower, Choose thou thy husband, and I'll pay thy dower; For I can guess that by thy honest aid Thou keep'st a wife herself, thyself a maid. Of that and all the progress, more or less, Resolvedly more leisure shall express: All yet seems well; and if it end so meet, The bitter past, more welcome is the sweet. EPILOGUE The king's a beggar, now the play is done: All is well ended, if this suit be won, That you express content; which we will pay, With strife to please you, day exceeding day: Ours be your patience then, and yours our parts; Your gentle hands lend us, and take our hearts.",ckqi3jopcea2a0yu3dcwwa4uz,2.0,0.0,2
290,Like or find fault; do as your pleasures are:,ckqi3joofe8mr0yu36fbaet8x,0.0,0.0,4
291,"Lo yonder, and Titinius mourning it.",ckqi3joobe8gx0yu31h4lfg4j,0.0,0.0,2
292,Look how he laughs already.,ckqi3jopvebdi0yu39m5hf4hz,0.0,0.0,3
293,"Lustig, as the Dutchman says: I'll like a maid the better, whilst I have a tooth in my head: why, he's able to lead her a coranto.",ckqi3jooee8k40yu3cfmx46tz,0.0,0.0,2
294,"Madam and mistress, a thousand good-morrows.",ckqi3jooje8zt0yu39nlr98oy,3.0,0.0,3
295,"Madam, here comes my lord.",ckqi3jooke91r0yu31y265bw7,0.0,0.0,3
296,"Madam, methinks, if you did love him dearly, You do not hold the method to enforce The like from him.",ckqi3joo7e87m0yu3d4kvbi72,1.0,0.0,2
297,"Madam, though Venus govern your desires, Saturn is dominator over mine: What signifies my deadly-standing eye, My silence and my cloudy melancholy, My fleece of woolly hair that now uncurls Even as an adder when she doth unroll To do some fatal execution? No, madam, these are no venereal signs: Vengeance is in my heart, death in my hand, Blood and revenge are hammering in my head. Hark Tamora, the empress of my soul, Which never hopes more heaven than rests in thee, This is the day of doom for Bassianus: His Philomel must lose her tongue to-day, Thy sons make pillage of her chastity And wash their hands in Bassianus' blood. Seest thou this letter? take it up, I pray thee, And give the king this fatal plotted scroll. Now question me no more; we are espied; Here comes a parcel of our hopeful booty, Which dreads not yet their lives' destruction.",ckqi3joq0ebub0yu37hxn3tz1,0.0,4.0,4
298,"Mark Antony, shall we give sign of battle?",ckqi3joome9c10yu36j3t79ai,0.0,0.0,2
299,Mark how he trembles in his ecstasy!,ckqi3jooqe9mb0yu3bohv59vv,0.0,1.0,4
300,"Marry to-- Come captain, will you go?",ckqi3jop9e9vc0yu3dvt8ghsv,0.0,0.0,3
301,"Marry, God forbid.",ckqi3jooge8po0yu3a12l476n,0.0,0.0,3
302,"Marry, at the white hair that Helen spied on Troilus' chin.",ckqi3joohe8tu0yu3dmugfq1v,0.0,0.0,2
303,"Marry, on Hero, the daughter and heir of Leonato.",ckqi3joppeara0yu3a1d15l20,0.0,0.0,3
304,"Marry, sir, she's the kitchen wench and all grease; and I know not what use to put her to but to make a lamp of her and run from her by her own light. I warrant, her rags and the tallow in them will burn a Poland winter: if she lives till doomsday, she'll burn a week longer than the whole world. ANTIPHOLUS",ckqi3joo6e8540yu35xyvhzkt,0.0,2.0,3
305,"Marry, thus: when it stands well with him, it stands well with her.",ckqi3joq0ebvk0yu34ip13cak,0.0,0.0,4
306,May I change these garments?,ckqi3joole95s0yu3g2yyd69b,0.0,0.0,4
307,"May they perceive's intent! He will require them, As if he did contemn what he requested Should be in them to give.",ckqi3jopoeano0yu36p11gcao,0.0,0.0,2
308,"Men's eyes were made to look, and let them gaze; I will not budge for no man's pleasure, I.",ckqi3joole9710yu374yr2401,0.0,0.0,3
309,Mine honesty and I begin to square. The loyalty well held to fools does make Our faith mere folly: yet he that can endure To follow with allegiance a fall'n lord Does conquer him that did his master conquer And earns a place i' the story.,ckqi3joq1ebwy0yu32p8jerxe,0.0,0.0,2
310,"Mine, fifty talents.",ckqi3jopyebmo0yu34484cp52,0.0,0.0,4
311,Most rare.,ckqi3jooee8ja0yu3cww0g5pd,0.0,0.0,3
312,Must I bite?,ckqi3jooie8xq0yu3dcyw4s43,0.0,0.0,3
313,"My commission Is not to reason of the deed, but do it.",ckqi3joone9e90yu3bnzv0scz,0.0,0.0,4
314,"My doe with the black scut? Let the sky  rain potatoes. Let it thunder to the tune of ""Green sleeves,"" hail kissing-comfits, and snow eringoes. Let  there come a tempest of provocation, I will shelter me  here.",ckqi3jopoeam00yu3dnm5fqu4,0.0,0.0,3
315,"My good Lysander, I swear to thee by Cupid's strongest bow, By his best arrow with the golden head, By the simplicity of Venus' doves, By that which knitteth souls and prospers love, And by that fire which burned the Carthage queen When the false Trojan under sail was seen, By all the vows that ever men have broke (In number more then ever women spoke), In that same place thou hast appointed me Tomorrow truly will I meet with thee.",ckqi3joope9ki0yu3ep760ajh,2.0,0.0,2
316,"My kind Antonio, I can no other answer make but thanks, And thanks, and ever thanks; and oft good turns Are shuffled off with such uncurrent pay. But were my worth, as is my conscience, firm, You should find better dealing. What's to do? Shall we go see the relics of this town?",ckqi3joppearp0yu37h5x8s2i,3.0,0.0,3
317,"My life itself, and the best heart of it, Thanks you for this great care: I stood i' the level Of a full-charged confederacy, and give thanks To you that choked it. Let be call'd before us That gentleman of Buckingham's; in person I'll hear him his confessions justify; And point by point the treasons of his master He shall again relate.",ckqi3jopseb100yu32kapgeri,3.0,0.0,3
318,"My lord, I have consider'd with myself The title of this most renowned duke; And in my conscience do repute his grace The rightful heir to England's royal seat.",ckqi3joohe8sv0yu38v5th1xc,0.0,0.0,3
319,"My lord, They have all been touch'd and found base metal, for They have au denied him.",ckqi3jooqe9na0yu3fwpa7fsc,0.0,0.0,3
320,"My lord, here comes the rascal I spoke of; here with the provost.",ckqi3jopeea8y0yu39lvcgm9l,0.0,2.0,4
321,"My lord, the army of the Duke of Buckingham--",ckqi3joome9ad0yu3hswr8sl6,0.0,0.0,3
322,"My lords ambassadors, your several suits Have been consider'd and debated on. And therefore are we certainly resolved To draw conditions of a friendly peace; Which by my Lord of Winchester we mean Shall be transported presently to France.",ckqi3jopdea5h0yu30t9z71ud,1.0,0.0,3
323,"My love, forbear to fawn upon their frowns: What danger or what sorrow can befall thee, So long as Edward is thy constant friend, And their true sovereign, whom they must obey? Nay, whom they shall obey, and love thee too, Unless they seek for hatred at my hands; Which if they do, yet will I keep thee safe, And they shall feel the vengeance of my wrath.",ckqi3jopteb5b0yu31ogzbt0k,1.0,3.0,3
324,"My noble masters, hear me speak.",ckqi3jopcea3e0yu3add3awcs,0.0,0.0,3
325,Name them.,ckqi3jopcea250yu3cxhma4d8,0.0,0.0,3
326,"Nay, 'tis strange, 'tis very strange, that is the brief and the tedious of it; and he's of a most facinerious spirit that will not acknowledge it to be the--",ckqi3joome9bh0yu33urhdnb2,0.0,1.0,3
327,"Nay, I prithee put on this gown, and this beard;  make him believe thou art Sir Topaz the curate. Do it  quickly. I'll call Sir Toby the whilst.",ckqi3jopoeamf0yu30d43ak94,0.0,0.0,3
328,"Nay, but I know who loves him.",ckqi3jopreaxt0yu321sw8hx3,0.0,0.0,2
329,"Nay, take away this scolding crookback rather.",ckqi3joq0ebuv0yu3hou9g55q,0.0,2.0,3
330,"Nay, take me with thee, good sweet Exeter: Not that I fear to stay, but love to go Whither the queen intends. Forward; away!",ckqi3jopdea6l0yu3dybj6bn7,1.0,0.0,3
331,"Neighbours, you are tedious.",ckqi3jopgeaie0yu38otraks5,0.0,3.0,3
332,"No quips now, Pistol: Indeed I am in the waist  two yards about, but I am now about no waste. I am a bout thrift. Briefly, I do mean to make love to Ford's  wife. I spy entertainment in her. She discourses, she  carves, she gives the leer of invitation. I can construe  the action of her familiar style; and the hardest voice of her  behavior -- to be Englished rightly -- is ""I am Sir John Falstafs's.""",ckqi3jopae9xu0yu389kdhrbi,0.0,1.0,2
333,"No, I warrant you.",ckqi3jopyebn30yu3bksy3nt5,0.0,0.0,3
334,"No, friend, cannot you beg? Here's them in our country Greece gets more with begging than we can do with working.",ckqi3joo9e8bi0yu3crc6gs5z,0.0,0.0,3
335,"No, his conscience Has crept too near another lady.",ckqi3joobe8fj0yu33ytx39l0,0.0,0.0,3
336,"No, let me speak; and let me rail so high, That the false housewife Fortune break her wheel, Provoked by my offence.",ckqi3jooge8p90yu3cu4pgut5,0.0,1.0,3
337,"No, not a word; how can I grace my talk, Wanting a hand to give it action? Thou hast the odds of me; therefore no more.",ckqi3joobe8fo0yu31gcefltt,0.0,1.0,2
338,"No, pray thee. I must obey; his art is of such power It would control my dam's god Setebos And make a vassal of him.",ckqi3joofe8nb0yu3ec08dbt2,0.0,0.0,3
339,"No, sir: yet oft, When blows have made me stay, I fled from words. You soothed not, therefore hurt not: but your people, I love them as they weigh.",ckqi3joore9qw0yu3fpgs5yam,2.0,0.0,3
340,"No, they are both as whole as a fish.",ckqi3jopxebjm0yu3512wbega,0.0,0.0,2
341,No; For we were subjects but while you were king.,ckqi3jopxebi80yu349gc87k9,0.0,0.0,4
342,"None! The music of the spheres! List, my Marina.",ckqi3jopqeavq0yu37aljadpj,0.0,0.0,3
343,"None, madam.",ckqi3jooke92b0yu31f6a2euk,0.0,0.0,2
344,"Not I, for this fair island; I do love Cassio well, and would do much To cure him of this evil-- --but hark, what noise?",ckqi3jopreawk0yu3ateo3ul2,2.0,0.0,2
345,Not know me yet?,ckqi3jopae9xa0yu357i0be5w,0.0,0.0,3
346,"Not to kill him, having a warrant for it; but to be damned for killing him, from which no warrant can defend us.",ckqi3jopae9xp0yu3farjen9k,0.0,1.0,3
347,"Not yet, my cousin: we would be resolved, Before we hear him, of some things of weight That task our thoughts, concerning us and France.",ckqi3jooce8iq0yu362jch9gs,0.0,0.0,4
348,"Nothing, Messala.",ckqi3jopfeafw0yu32xumfxkt,0.0,0.0,3
349,Nothing.,ckqi3jopcea4n0yu32vszcej2,0.0,0.0,3
350,"Now all the blessings Of a glad father compass thee about: Arise, and say how thou cam'st here.",ckqi3joome9b70yu311h3c5ho,2.0,0.0,2
351,"Now by my soul, I would it were this hour.",ckqi3jooee8jz0yu36r1o178n,0.0,0.0,3
352,"Now entertain conjecture of a time When creeping murmur and the poring dark Fills the wide vessel of the universe. From camp to camp through the foul womb of night The hum of either army stilly sounds, That the fixed sentinels almost receive The secret whispers of each other's watch: Fire answers fire, and through their paly flames Each battle sees the other's umber'd face; Steed threatens steed, in high and boastful neighs Piercing the night's dull ear, and from the tents The armourers, accomplishing the knights, With busy hammers closing rivets up, Give dreadful note of preparation: The country cocks do crow, the clocks do toll, And the third hour of drowsy morning name. Proud of their numbers and secure in soul, The confident and over-lusty French Do the low-rated English play at dice; And chide the cripple tardy-gaited night Who, like a foul and ugly witch, doth limp So tediously away. The poor condemned English, Like sacrifices, by their watchful fires Sit patiently and inly ruminate The morning's danger, and their gesture sad Investing lank-lean; cheeks and war-worn coats Presenteth them unto the gazing moon So many horrid ghosts. O now, who will behold The royal captain of this ruin'd band Walking from watch to watch, from tent to tent, Let him cry 'Praise and glory on his head!' For forth he goes and visits all his host. Bids them good morrow with a modest smile And calls them brothers, friends and countrymen. Upon his royal face there is no note How dread an army hath enrounded him; Nor doth he dedicate one jot of colour Unto the weary and all-watched night, But freshly looks and over-bears attaint With cheerful semblance and sweet majesty; That every wretch, pining and pale before, Beholding him, plucks comfort from his looks: A largess universal like the sun His liberal eye doth give to every one, Thawing cold fear, that mean and gentle all, Behold, as may unworthiness define, A little touch of Harry in the night. And so our scene must to the battle fly; Where--O for pity!--we shall much disgrace With four or five most vile and ragged foils, Right ill-disposed in brawl ridiculous, The name of Agincourt. Yet sit and see, Minding true things by what their mockeries be.",ckqi3jopyebor0yu3d6dqahpz,0.0,1.0,3
353,"Now the fair goddess, Fortune, Fall deep in love with thee; and her great charms Misguide thy opposers' swords! Bold gentleman, Prosperity be thy page!",ckqi3jopdea7f0yu30cs2bynk,2.0,0.0,3
354,"Now the melancholy god protect thee, and the  tailor make thy doublet of changeable taffeta, for thy  mind is a very opal. I would have men of such  constancy put to sea, that their business might be everything,  and their intent everywhere; for that's it that always  makes a good voyage of nothing. Farewell.",ckqi3jopzebqf0yu38feecs2v,1.0,0.0,3
355,Now to the bottom dost thou search my wound: Poor Bassianus here lies murdered.,ckqi3jopeea8o0yu31e2p1nt2,1.0,0.0,3
356,"Now, Apemantus, if thou wert not sullen, I would be good to thee.",ckqi3joohe8uy0yu33rpo1q24,0.0,2.0,3
357,"Now, God incense him, And let him cry Ha! louder!",ckqi3joobe8g30yu30azq7zi9,0.0,1.0,2
358,"Now, blessing on thee! rise; thou art my child. Give me fresh garments. Mine own, Helicanus; She is not dead at Tarsus, as she should have been, By savage Cleon: she shall tell thee all; When thou shalt kneel, and justify in knowledge She is thy very princess. Who is this?",ckqi3jopoeamu0yu3g6cscjqc,2.0,1.0,3
359,"Now, by the world, it is a lusty wench; I love her ten times more than e'er I did: O, how I long to have some chat with her!",ckqi3jooqe9mg0yu301ou6ngn,1.0,1.0,3
360,"Now, justice on the doers!",ckqi3jopwebfl0yu3a8ku3dm4,0.0,1.0,2
361,"Now, madam, summon up your dearest spirits: Consider who the king your father sends, To whom he sends, and what's his embassy: Yourself, held precious in the world's esteem, To parley with the sole inheritor Of all perfections that a man may owe, Matchless Navarre; the plea of no less weight Than Aquitaine, a dowry for a queen. Be now as prodigal of all dear grace As Nature was in making graces dear When she did starve the general world beside And prodigally gave them all to you.",ckqi3jooae8cr0yu37xc0ai7l,2.0,0.0,3
362,"Now, pretty one, how long have you been at this trade?",ckqi3jopueb9h0yu3ekp1apgs,0.0,0.0,3
363,"Now, what news?",ckqi3joo6e84a0yu30uewhw02,0.0,0.0,3
364,"O Lord, sir! Nay, put me to't, I warrant you.",ckqi3jop9e9x00yu3czna5ucl,0.0,0.0,2
365,"O Lord, sir! why, there't serves well again.",ckqi3joofe8o00yu3hpj24qg9,0.0,0.0,4
366,"O Tullus,--",ckqi3jopwebf60yu3byru7yu4,0.0,0.0,2
367,O bon Dieu! les langues des hommes sont pleines de tromperies.,ckqi3joppeaqg0yu39mx8g78f,0.0,1.0,3
368,"O comfortable friar! where is my lord? I do remember well where I should be, And there I am. Where is my Romeo?",ckqi3jooqe9n50yu3ca2ef6y3,1.0,0.0,4
369,"O for a Muse of fire, that would ascend The brightest heaven of invention, A kingdom for a stage, princes to act And monarchs to behold the swelling scene! Then should the warlike Harry, like himself, Assume the port of Mars; and at his heels, Leash'd in like hounds, should famine, sword and fire Crouch for employment. But pardon, and gentles all, The flat unraised spirits that have dared On this unworthy scaffold to bring forth So great an object: can this cockpit hold The vasty fields of France? or may we cram Within this wooden O the very casques That did affright the air at Agincourt? O, pardon! since a crooked figure may Attest in little place a million; And let us, ciphers to this great accompt, On your imaginary forces work. Suppose within the girdle of these walls Are now confined two mighty monarchies, Whose high upreared and abutting fronts The perilous narrow ocean parts asunder: Piece out our imperfections with your thoughts; Into a thousand parts divide on man, And make imaginary puissance; Think when we talk of horses, that you see them Printing their proud hoofs i' the receiving earth; For 'tis your thoughts that now must deck our kings, Carry them here and there; jumping o'er times, Turning the accomplishment of many years Into an hour-glass: for the which supply, Admit me Chorus to this history; Who prologue-like your humble patience pray, Gently to hear, kindly to judge, our play.",ckqi3joofe8n60yu34pv7d272,0.0,1.0,4
370,O monstrous! eleven buckram men grown out of two!,ckqi3joole95x0yu39ts285f7,0.0,2.0,3
371,"O my good lord! Sweet Isabel, take my part; Lend me your knees, and all my life to come I'll lend you all my life to do you service.",ckqi3jop8e9t90yu36zne3xwu,3.0,0.0,3
372,"O, here's Servilius; now we shall know some answer.",ckqi3jopyebow0yu30img47fl,0.0,0.0,1
373,"O, let their bodies follow, my dear liege, With blood and sword and fire to win your right; In aid whereof we of the spiritualty Will raise your highness such a mighty sum As never did the clergy at one time Bring in to any of your ancestors.",ckqi3joo9e8ae0yu3hlqa080k,2.0,1.0,3
374,"O, pardon; I offend.",ckqi3jop9e9v70yu35n7rglpa,1.0,0.0,4
375,"O, tell, tell.",ckqi3jopeea930yu37n1zhm7x,0.0,0.0,3
376,"O, that delightful engine of her thoughts That blabb'd them with such pleasing eloquence, Is torn from forth that pretty hollow cage, Where, like a sweet melodious bird, it sung Sweet varied notes, enchanting every ear!",ckqi3jopyebm90yu35qaw7rsb,3.0,0.0,4
377,"O, the Lord preserve thy good grace! by my troth, welcome to London. Now, the Lord bless that sweet face of thine! O, Jesu, are you come from Wales?",ckqi3jopvebal0yu3ayxmgrm7,3.0,0.0,3
378,"O, true, good Catesby: bid him levy straight The greatest strength and power he can make, And meet me presently at Salisbury.",ckqi3joo6e85y0yu3b6np3lx9,2.0,0.0,3
379,"O, what men dare do! what men may do! what men daily do, not knowing what they do!",ckqi3joole97v0yu36dlf14y2,0.0,0.0,3
380,"O, wilt thou leave me so unsatisfied?",ckqi3jopzebro0yu3b3guabor,0.0,0.0,2
381,"Oh, base Hungarian wight! Wilt thou the spigot wield?",ckqi3jop8e9tt0yu3at20gv7e,0.0,1.0,2
382,"Oh, that deceit should steal such gentle shapes, And with a virtuous vizard hide foul guile! He is my son; yea, and therein my shame; Yet from my dugs he drew not this deceit.",ckqi3jooee8kj0yu3f1xz7f0n,0.0,2.0,2
383,"Our business is not unknown to the senate; they have had inkling this fortnight what we intend to do, which now we'll show 'em in deeds. They say poor suitors have strong breaths: they shall know we have strong arms too.",ckqi3jop8e9sf0yu331va7g3a,0.0,3.0,3
